tweet_id,timestamp,source,text,expanded_urls,rating_numerator,rating_denominator,name,date,time,dog_stage,jpg_url,dog_breed,favorite_count,retweet_count
6.797220165812224e+17,2015-12-23 17:55:32+00:00,Twitter for iPhone,This is Mike. He is a Jordanian Frito Pilates. Frowning because he can't see directly in front of him. 8/10 https://t.co/NL5QJwdEpF,https://twitter.com/dog_rates/status/679722016581222400/photo/1,8.0,10.0,Mike,2015-12-23,17:55:32,,https://pbs.twimg.com/media/CW7bkW6WQAAksgB.jpg,boxer,1688,476
6.795302801143726e+17,2015-12-23 05:13:38+00:00,Twitter for iPhone,Guys this really needs to stop. We've been over this way too many times. This is a giraffe. We only rate dogs.. 7/10 https://t.co/yavgkHYPOC,https://twitter.com/dog_rates/status/679530280114372609/photo/1,7.0,10.0,,2015-12-23,05:13:38,,https://pbs.twimg.com/media/CW4tL1vWcAIw1dw.jpg,dalmatian,4872,2131
6.795278020314849e+17,2015-12-23 05:03:47+00:00,Twitter for iPhone,This little pupper just arrived. 11/10 would snug https://t.co/DA5aqnSGfB,https://twitter.com/dog_rates/status/679527802031484928/photo/1,11.0,10.0,,2015-12-23,05:03:47,pupper,https://pbs.twimg.com/media/CW4q7jDWkAA2y8g.jpg,,2693,737
6.7951135187055e+17,2015-12-23 03:58:25+00:00,Twitter for iPhone,Say hello to William. He makes fun of others because he's terrified of his own deep-seated insecurities. 7/10 https://t.co/bwuV6FlRxr,https://twitter.com/dog_rates/status/679511351870550016/photo/1,7.0,10.0,,2015-12-23,03:58:25,,https://pbs.twimg.com/media/CW4b-GUWYAAa8QO.jpg,chihuahua,3436,1294
6.795033732724859e+17,2015-12-23 03:26:43+00:00,Twitter for iPhone,This is Dwight. He's a pointy pupper. Very docile. Attracts marshmallows. Hurts to pet but definitely worth it 8/10 https://t.co/jjW7zTxY9Z,https://twitter.com/dog_rates/status/679503373272485890/photo/1,8.0,10.0,Dwight,2015-12-23,03:26:43,pupper,https://pbs.twimg.com/media/CW4UtmYWsAAEjqA.jpg,,3214,1506
6.794759515169341e+17,2015-12-23 01:37:45+00:00,Twitter for iPhone,This is Evy. She doesn't want to be a Koala. 9/10 https://t.co/VITeF0Kl9L,https://twitter.com/dog_rates/status/679475951516934144/photo/1,9.0,10.0,Evy,2015-12-23,01:37:45,,https://pbs.twimg.com/media/CW37xZbUoAAUXe5.jpg,maltese_dog,2129,654
6.794628231356867e+17,2015-12-23 00:45:35+00:00,Twitter for iPhone,Meet Hurley. He's the curly one. He hugs every other dog he sees during his walk. 11/10 for spreading the love https://t.co/M6vqkt2GKV,https://twitter.com/dog_rates/status/679462823135686656/photo/1,11.0,10.0,Hurley,2015-12-23,00:45:35,,https://pbs.twimg.com/media/CW3v1KxW8AAIOuy.jpg,toy_poodle,32340,19267
6.791583739888763e+17,2015-12-22 04:35:49+00:00,Twitter for iPhone,This is Rubio. He has too much skin. 11/10 https://t.co/NLOHmlENag,https://twitter.com/dog_rates/status/679158373988876288/photo/1,11.0,10.0,Rubio,2015-12-22,04:35:49,,https://pbs.twimg.com/media/CWza7kpWcAAdYLc.jpg,pug,21806,8223
6.791487632319857e+17,2015-12-22 03:57:37+00:00,Twitter for iPhone,I know everyone's excited for Christmas but that doesn't mean you can send in reindeer. We only rate dogs... 8/10 https://t.co/eWjWgbOCYL,https://twitter.com/dog_rates/status/679148763231985668/photo/1,8.0,10.0,,2015-12-22,03:57:37,,https://pbs.twimg.com/media/CWzSMmAWsAAyB1u.jpg,italian_greyhound,2829,1051
6.791324357501952e+17,2015-12-22 02:52:45+00:00,Twitter for iPhone,This is Louis. He's a river dancer. His friends think it's badass. All are very supportive. 10/10 for Louis https://t.co/qoIvjKMY58,https://twitter.com/dog_rates/status/679132435750195208/photo/1,10.0,10.0,Louis,2015-12-22,02:52:45,,https://pbs.twimg.com/media/CWzDWOkXAAAP0k7.jpg,scottish_deerhound,3018,1183
6.791112166908314e+17,2015-12-22 01:28:25+00:00,Twitter for iPhone,This is officially the greatest yawn of all time. 12/10 https://t.co/4R0Cc0sLVE,https://twitter.com/dog_rates/status/679111216690831360/video/1,12.0,10.0,,2015-12-22,01:28:25,,https://pbs.twimg.com/ext_tw_video_thumb/679111114081370114/pu/img/hFca8BHjRopgD0cM.jpg,kelpie,6085,2617
6.790626142704681e+17,2015-12-21 22:15:18+00:00,Twitter for iPhone,This is Chompsky. He lives up to his name. 11/10 https://t.co/Xl37lQEWd0,"https://twitter.com/dog_rates/status/679062614270468097/photo/1,https://twitter.com/dog_rates/status/679062614270468097/photo/1",11.0,10.0,Chompsky,2015-12-21,22:15:18,,https://pbs.twimg.com/media/CWyD2HGUYAQ1Xa7.jpg,schipperke,17334,8323
6.790474851894395e+17,2015-12-21 21:15:11+00:00,Twitter for iPhone,This dog doesn't know how to stairs. Quite tragic really. 9/10 get it together pup https://t.co/kTpr9PTMg1,https://twitter.com/dog_rates/status/679047485189439488/photo/1,9.0,10.0,,2015-12-21,21:15:11,,https://pbs.twimg.com/media/CWx2FaLWcAEQ3vh.jpg,golden_retriever,2288,685
6.789917722955162e+17,2015-12-21 17:33:48+00:00,Twitter for iPhone,If your Monday isn't going so well just take a look at this. Both 12/10 https://t.co/GJT6SILPGU,https://twitter.com/dog_rates/status/678991772295516161/photo/1,12.0,10.0,,2015-12-21,17:33:48,,https://pbs.twimg.com/media/CWxDaXHWsAAWV8W.jpg,eskimo_dog,2354,1194
6.789692287042847e+17,2015-12-21 16:04:13+00:00,Twitter for iPhone,Meet Lola. She's a Metamorphic Chartreuse. Plays with her food. Insubordinate and churlish. Exquisite hardwood 11/10 https://t.co/etpBNXwN7f,https://twitter.com/dog_rates/status/678969228704284672/photo/1,11.0,10.0,Lola,2015-12-21,16:04:13,,https://pbs.twimg.com/media/CWwu6OLUkAEo3gq.jpg,labrador_retriever,1675,472
6.78800283649069e+17,2015-12-21 04:52:53+00:00,Twitter for iPhone,Here's a pupper with some mean tan lines. Snazzy sweater though 12/10 https://t.co/DpCSVsl6vu,https://twitter.com/dog_rates/status/678800283649069056/photo/1,12.0,10.0,,2015-12-21,04:52:53,pupper,https://pbs.twimg.com/media/CWuVQSLW4AAI3w9.jpg,labrador_retriever,2624,923
6.787982768423608e+17,2015-12-21 04:44:55+00:00,Twitter for iPhone,This is Linda. She fucking hates trees. 7/10 https://t.co/blaY85FIxR,https://twitter.com/dog_rates/status/678798276842360832/photo/1,7.0,10.0,Linda,2015-12-21,04:44:55,,https://pbs.twimg.com/media/CWuTbAKUsAAvZHh.jpg,airedale,3511,1194
6.787749286074696e+17,2015-12-21 03:12:08+00:00,Twitter for iPhone,This is Tug. He's not required to wear the cone he just wants his voice to project more clearly. 11/10 https://t.co/Sp739Ou2qx,https://twitter.com/dog_rates/status/678774928607469569/photo/1,11.0,10.0,Tug,2015-12-21,03:12:08,,https://pbs.twimg.com/media/CWt-MNIWEAAUC9S.jpg,pembroke,2853,930
6.787671403469414e+17,2015-12-21 02:41:11+00:00,Twitter for iPhone,This is Mia. She makes awful decisions. 8/10 https://t.co/G6TQVgTcZz,https://twitter.com/dog_rates/status/678767140346941444/photo/1,8.0,10.0,Mia,2015-12-21,02:41:11,,https://pbs.twimg.com/media/CWt3G6EVEAIGEPr.jpg,,3602,1388
6.78764513869611e+17,2015-12-21 02:30:45+00:00,Twitter for iPhone,"Meet Wilson. He got caught humping the futon. He's like ""dude, help me out here"" 10/10 I'd help Wilson out https://t.co/m6XoclB0qv",https://twitter.com/dog_rates/status/678764513869611008/photo/1,10.0,10.0,Wilson,2015-12-21,02:30:45,,https://pbs.twimg.com/media/CWt0ubZWcAAkFER.jpg,irish_terrier,1661,486
6.787552396301271e+17,2015-12-21 01:53:54+00:00,Twitter for iPhone,This is Dash. He didn't think the water would be that cold. Damn it Dash it's December. Think a little. 10/10 https://t.co/NqcOwG8pxW,https://twitter.com/dog_rates/status/678755239630127104/photo/1,10.0,10.0,Dash,2015-12-21,01:53:54,,https://pbs.twimg.com/media/CWtsSQAUkAAnWws.jpg,malamute,7255,3352
6.787400353620378e+17,2015-12-21 00:53:29+00:00,Twitter for iPhone,Meet Tango. He's a large dog. Doesn't care much for personal space. Owner isn't very accepting. Tongue slip. 6/10 https://t.co/p2T5kGebxe,https://twitter.com/dog_rates/status/678740035362037760/photo/1,6.0,10.0,Tango,2015-12-21,00:53:29,,https://pbs.twimg.com/media/CWtede2WIAAF_AJ.jpg,beagle,3819,1714
6.786758431834849e+17,2015-12-20 20:38:24+00:00,Twitter for iPhone,Exotic pup here. Tail long af. Throat looks swollen. Might breathe fire. Exceptionally unfluffy 2/10 would still pet https://t.co/a8SqCaSo2r,https://twitter.com/dog_rates/status/678675843183484930/photo/1,2.0,10.0,,2015-12-20,20:38:24,,https://pbs.twimg.com/media/CWskEqnWUAAQZW_.jpg,,2913,1502
6.786434571461509e+17,2015-12-20 18:29:43+00:00,Twitter for iPhone,Meet Grizz. He just arrived. Couldn't wait until Christmas. Worried bc he saw the swastikas on the carpet. 10/10 https://t.co/QBGwYrT7rv,https://twitter.com/dog_rates/status/678643457146150913/photo/1,10.0,10.0,Grizz,2015-12-20,18:29:43,,https://pbs.twimg.com/media/CWsGnyMVEAAM1Y1.jpg,labrador_retriever,2082,425
6.784461515704279e+17,2015-12-20 05:25:42+00:00,Twitter for iPhone,Touching scene here. Really stirs up the emotions. The bond between father &amp; son. So beautiful. 10/10 for both pups https://t.co/AJWJHov5gx,https://twitter.com/dog_rates/status/678446151570427904/photo/1,10.0,10.0,,2015-12-20,05:25:42,,https://pbs.twimg.com/media/CWpTLOYWsAEDhcU.jpg,staffordshire_bullterrier,4074,1588
6.784243121063936e+17,2015-12-20 03:58:55+00:00,Twitter for iPhone,This is Crystal. She's a shitty fireman. No sense of urgency. People could be dying Crystal. 2/10 just irresponsible https://t.co/rtMtjSl9pz,https://twitter.com/dog_rates/status/678424312106393600/photo/1,2.0,10.0,Crystal,2015-12-20,03:58:55,,https://pbs.twimg.com/media/CWo_T8gW4AAgJNo.jpg,maltese_dog,5509,2594
6.784102103152476e+17,2015-12-20 03:02:53+00:00,Twitter for iPhone,Say hello to Jerome. He can shoot french fries out of his mouth at insane speeds. Deadly af. 10/10 https://t.co/dIy88HwrX8,https://twitter.com/dog_rates/status/678410210315247616/photo/1,10.0,10.0,,2015-12-20,03:02:53,,https://pbs.twimg.com/media/CWoyfMiWUAAmGdd.jpg,schipperke,4306,1854
6.783996521993093e+17,2015-12-20 02:20:55+00:00,Twitter for iPhone,This made my day. 12/10 please enjoy https://t.co/VRTbo3aAcm,https://twitter.com/dog_rates/status/678399652199309312/video/1,12.0,10.0,,2015-12-20,02:20:55,,https://pbs.twimg.com/ext_tw_video_thumb/678399528077250560/pu/img/BOjUNHRsYLeSo0hl.jpg,bedlington_terrier,80503,32390
6.783967962599752e+17,2015-12-20 02:09:34+00:00,Twitter for iPhone,These little fellas have opposite facial expressions. Both 12/10 https://t.co/LmThv0GWen,"https://twitter.com/dog_rates/status/678396796259975168/photo/1,https://twitter.com/dog_rates/status/678396796259975168/photo/1",12.0,10.0,,2015-12-20,02:09:34,,https://pbs.twimg.com/media/CWomSU_XIAAUYiK.jpg,pembroke,1620,422
6.78389028614488e+17,2015-12-20 01:38:42+00:00,Twitter for iPhone,"This is Bella. She just learned that her final grade in chem was a 92.49 
poor pupper 11/10 https://t.co/auOoKuoveM",https://twitter.com/dog_rates/status/678389028614488064/photo/1,11.0,10.0,Bella,2015-12-20,01:38:42,pupper,https://pbs.twimg.com/media/CWofOHUWUAACGVa.jpg,miniature_pinscher,1900,433
6.783802368625787e+17,2015-12-20 01:03:46+00:00,Twitter for iPhone,This is Crumpet. He underestimated the snow. Quickly retreating. 10/10 https://t.co/a0Zx5LDFZa,https://twitter.com/dog_rates/status/678380236862578688/photo/1,10.0,10.0,Crumpet,2015-12-20,01:03:46,,https://pbs.twimg.com/media/CWoXOfSUAAA4u8g.jpg,samoyed,2483,928
6.783410753759478e+17,2015-12-19 22:28:09+00:00,Twitter for iPhone,This pupper likes tape. 12/10 https://t.co/cSp6w5GWgm,https://twitter.com/dog_rates/status/678341075375947776/photo/1,12.0,10.0,,2015-12-19,22:28:09,pupper,https://pbs.twimg.com/media/CWnznDTU4AAa-6P.jpg,golden_retriever,1753,545
6.783344973608591e+17,2015-12-19 22:02:01+00:00,Twitter for iPhone,This is Rosie. She has a snazzy bow tie and a fin for a tail. Probably super fast underwater. Cool socks 10/10 https://t.co/GO76MdGBs0,https://twitter.com/dog_rates/status/678334497360859136/photo/1,10.0,10.0,Rosie,2015-12-19,22:02:01,,https://pbs.twimg.com/media/CWntoDVWcAEl3NB.jpg,norfolk_terrier,1320,259
6.782785861309481e+17,2015-12-19 18:19:51+00:00,Twitter for iPhone,Another spooky pupper here. Most definitely floating. No legs. Probably knows some dark magic. 10/10 very spooked https://t.co/JK8MByRzgj,https://twitter.com/dog_rates/status/678278586130948096/photo/1,10.0,10.0,,2015-12-19,18:19:51,pupper,https://pbs.twimg.com/media/CWm6xySUEAAqfFU.jpg,maltese_dog,11605,6181
6.782554641828618e+17,2015-12-19 16:47:58+00:00,Twitter for iPhone,This is Jessifer. She is a Bismoth Teriyaki. Flowers being attacked by hurricanes on bandana (rad). 9/10 stellar pup https://t.co/nZhmRwZzWv,https://twitter.com/dog_rates/status/678255464182861824/photo/1,9.0,10.0,Jessifer,2015-12-19,16:47:58,,https://pbs.twimg.com/media/CWmlvxJU4AEAqaN.jpg,chihuahua,1614,372
6.780211157180293e+17,2015-12-19 01:16:45+00:00,Twitter for iPhone,This is Reese. He likes holding hands. 12/10 https://t.co/cbLroGCbmh,https://twitter.com/dog_rates/status/678021115718029313/photo/1,12.0,10.0,Reese,2015-12-19,01:16:45,,https://pbs.twimg.com/media/CWjQm5gXAAA9GkD.jpg,miniature_pinscher,13935,6438
6.779185315147039e+17,2015-12-18 18:29:07+00:00,Twitter for iPhone,"""Everything looks pretty good in there. Make sure to brush your gums. Been flossing? How's school going?"" Both 10/10 https://t.co/lWL2IMJqLR",https://twitter.com/dog_rates/status/677918531514703872/photo/1,10.0,10.0,,2015-12-18,18:29:07,,https://pbs.twimg.com/media/CWhzTbzWUAAEAUN.jpg,eskimo_dog,1373,420
6.778951012182016e+17,2015-12-18 16:56:01+00:00,Twitter for iPhone,Guys this was terrifying. Really spooked me up. We don't rate ghosts. We rate dogs. Please only send dogs... 9/10 https://t.co/EJImi1udYb,https://twitter.com/dog_rates/status/677895101218201600/photo/1,9.0,10.0,,2015-12-18,16:56:01,,https://pbs.twimg.com/media/CWhd_7WWsAAaqWG.jpg,dalmatian,4911,2129
6.777165157943296e+17,2015-12-18 05:06:23+00:00,Twitter for iPhone,IT'S PUPPERGEDDON. Total of 144/120 ...I think https://t.co/ZanVtAtvIq,https://twitter.com/dog_rates/status/677716515794329600/photo/1,12.0,10.0,,2015-12-18,05:06:23,,https://pbs.twimg.com/media/CWe7kw9W4AE8UJh.jpg,chow,3108,989
6.777000033270292e+17,2015-12-18 04:00:46+00:00,Twitter for iPhone,This is Ralph. He's an interpretive dancer. 10/10 https://t.co/zoDdPyPFsa,https://twitter.com/dog_rates/status/677700003327029250/photo/1,10.0,10.0,Ralph,2015-12-18,04:00:46,,https://pbs.twimg.com/media/CWesj06W4AAIKl8.jpg,siberian_husky,3435,1467
6.776984035481928e+17,2015-12-18 03:54:25+00:00,Twitter for iPhone,This is Sadie. She got her holidays confused. 9/10 damn it Sadie https://t.co/fm7HxOsuPK,https://twitter.com/dog_rates/status/677698403548192770/photo/1,9.0,10.0,Sadie,2015-12-18,03:54:25,,https://pbs.twimg.com/media/CWerGmOXAAAm6NY.jpg,shih-tzu,1247,325
6.77687604918272e+17,2015-12-18 03:11:30+00:00,Twitter for iPhone,This was Cindy's face when she heard Susan forgot the snacks for after the kid's soccer game. 11/10 https://t.co/gzkuVGRgAD,https://twitter.com/dog_rates/status/677687604918272002/photo/1,11.0,10.0,,2015-12-18,03:11:30,,https://pbs.twimg.com/media/CWehRdEWIAAySyO.jpg,pembroke,2518,857
6.77673981332312e+17,2015-12-18 02:17:22+00:00,Twitter for iPhone,Endangered triangular pup here. Could be a wizard. Caught mid-laugh. No legs. Just fluff. Probably a wizard. 9/10 https://t.co/GFVIHIod0Z,https://twitter.com/dog_rates/status/677673981332312066/photo/1,9.0,10.0,,2015-12-18,02:17:22,,https://pbs.twimg.com/media/CWeU5LBWEAA8F0J.jpg,maltese_dog,3375,1523
6.776623729207296e+17,2015-12-18 01:31:14+00:00,Twitter for iPhone,"In honor of the new Star Wars movie. Here's Yoda pug. 12/10 pet really well, would I https://t.co/pvjdRn00XH",https://twitter.com/dog_rates/status/677662372920729601/photo/1,12.0,10.0,,2015-12-18,01:31:14,,https://pbs.twimg.com/media/CWeKTZTWsAA5R3Z.jpg,,1966,972
6.776440919293297e+17,2015-12-18 00:18:36+00:00,Twitter for iPhone,This is a dog swinging. I really enjoyed it so I hope you all do as well. 11/10 https://t.co/Ozo9KHTRND,https://twitter.com/dog_rates/status/677644091929329666/video/1,11.0,10.0,,2015-12-18,00:18:36,,https://pbs.twimg.com/ext_tw_video_thumb/677644010865999872/pu/img/zVHEMYnJKzq1SauT.jpg,chihuahua,1882,810
6.775737433093857e+17,2015-12-17 19:39:03+00:00,Twitter for iPhone,This is Sandy. He's sexually confused. Thinks he's a pigeon. Also an All-American cheese catcher. 10/10 so petable https://t.co/Htu8plSqEu,"https://twitter.com/dog_rates/status/677573743309385728/photo/1,https://twitter.com/dog_rates/status/677573743309385728/photo/1",10.0,10.0,Sandy,2015-12-17,19:39:03,,https://pbs.twimg.com/media/CWc5uVPXIAErLYr.jpg,,2161,727
6.775657153276887e+17,2015-12-17 19:07:09+00:00,Twitter for iPhone,Contortionist pup here. Inside pentagram. Clearly worships Satan. Known to slowly push fragile stuff off tables 6/10 https://t.co/EX9oR55VMe,https://twitter.com/dog_rates/status/677565715327688705/photo/1,6.0,10.0,,2015-12-17,19:07:09,,https://pbs.twimg.com/media/CWcybBmWcAAigAQ.jpg,basset,1312,470
6.77557565589463e+17,2015-12-17 18:34:46+00:00,Twitter for iPhone,Reckless pupper here. Not even looking at road. Absolute menace. No regard for fellow pupper lives. 10/10 still cute https://t.co/96IBkOYB7j,https://twitter.com/dog_rates/status/677557565589463040/photo/1,10.0,10.0,,2015-12-17,18:34:46,pupper,https://pbs.twimg.com/media/CWcrAVQWEAA6QMp.jpg,shih-tzu,2466,1173
6.775479285049672e+17,2015-12-17 17:56:29+00:00,Twitter for iPhone,Not much to say here. I just think everyone needs to see this. 12/10 https://t.co/AGag0hFHpe,https://twitter.com/dog_rates/status/677547928504967168/photo/1,12.0,10.0,,2015-12-17,17:56:29,,https://pbs.twimg.com/media/CWciPonWEAUOqLD.jpg,american_staffordshire_terrier,7023,3722
6.775300728872059e+17,2015-12-17 16:45:31+00:00,Twitter for iPhone,Say hello to Axel. He's a Black Chevy Pinot on wheels. 0 to 60 in 5.7 seconds (if downhill). 9/10 I call shotgun https://t.co/DKe9DBnnHE,https://twitter.com/dog_rates/status/677530072887205888/photo/1,9.0,10.0,,2015-12-17,16:45:31,,https://pbs.twimg.com/media/CWcSAI-WUAAOB9W.jpg,staffordshire_bullterrier,1085,233
6.773346151667302e+17,2015-12-17 03:48:51+00:00,Twitter for iPhone,This dog gave up mid jump. 9/10 https://t.co/KmMv3Y2zI8,"https://twitter.com/dog_rates/status/677334615166730240/photo/1,https://twitter.com/dog_rates/status/677334615166730240/photo/1",9.0,10.0,,2015-12-17,03:48:51,,https://pbs.twimg.com/media/CWZgPPUWUAAUOvu.jpg,lakeland_terrier,1366,290
6.77331501395157e+17,2015-12-17 03:36:28+00:00,Twitter for iPhone,Meet Humphrey. He's a Northern Polyp Viagra. One ear works. Face stuck like that. Always surprised. 9/10 petable af https://t.co/FS7eJQM2F4,https://twitter.com/dog_rates/status/677331501395156992/photo/1,9.0,10.0,Humphrey,2015-12-17,03:36:28,,https://pbs.twimg.com/media/CWZdaGxXAAAjGjb.jpg,beagle,1104,237
6.77328882937299e+17,2015-12-17 03:26:04+00:00,Twitter for iPhone,This is Derek. All the dogs adore Derek. He's a great guy. 10/10 really solid pup https://t.co/KgcsGNb61s,https://twitter.com/dog_rates/status/677328882937298944/photo/1,10.0,10.0,Derek,2015-12-17,03:26:04,,https://pbs.twimg.com/media/CWZbBlAUsAAjRg5.jpg,kelpie,3683,1526
6.773148121253233e+17,2015-12-17 02:30:09+00:00,Twitter for iPhone,"Meet Tassy &amp; Bee. Tassy is pretty chill, but Bee is convinced the Ruffles are haunted. 10/10 &amp; 11/10 respectively https://t.co/fgORpmTN9C","https://twitter.com/dog_rates/status/677314812125323265/photo/1,https://twitter.com/dog_rates/status/677314812125323265/photo/1",10.0,10.0,Tassy,2015-12-17,02:30:09,,https://pbs.twimg.com/media/CWZOOIUW4AAQrX_.jpg,blenheim_spaniel,1662,534
6.773010331697889e+17,2015-12-17 01:35:24+00:00,Twitter for iPhone,This is Juckson. He's totally on his way to a nascar race. 5/10 for Juckson https://t.co/IoLRvF0Kak,https://twitter.com/dog_rates/status/677301033169788928/photo/1,5.0,10.0,Juckson,2015-12-17,01:35:24,,https://pbs.twimg.com/media/CWZBsjPWsAAZFFl.jpg,japanese_spaniel,1248,408
6.77269281705472e+17,2015-12-16 23:29:14+00:00,Twitter for iPhone,This is the happiest pupper I've ever seen. 10/10 would trade lives with https://t.co/ep8ATEJwRb,https://twitter.com/dog_rates/status/677269281705472000/photo/1,10.0,10.0,,2015-12-16,23:29:14,pupper,https://pbs.twimg.com/media/CWYk0WxWoAAEwRt.jpg,shetland_sheepdog,2014,713
6.77228873407443e+17,2015-12-16 20:48:40+00:00,Twitter for iPhone,Say hello to Chuq. He just wants to fit in. 11/10 https://t.co/hGkMCjZzn4,https://twitter.com/dog_rates/status/677228873407442944/photo/1,11.0,10.0,,2015-12-16,20:48:40,,https://pbs.twimg.com/media/CWYAEINW4AIuw8P.jpg,,3585,1664
6.771873001876111e+17,2015-12-16 18:03:28+00:00,Twitter for iPhone,Here we see a Byzantine Rigatoni. Very aerodynamic. No eyes. Actually not windy here they just look like that. 9/10 https://t.co/gzI0m6wXRo,https://twitter.com/dog_rates/status/677187300187611136/photo/1,9.0,10.0,,2015-12-16,18:03:28,,https://pbs.twimg.com/media/CWXaQMBWcAAATDi.jpg,english_setter,2778,937
6.769755325804093e+17,2015-12-16 04:01:59+00:00,Twitter for iPhone,This is Cooper. He doesn't know how cheese works. Likes the way it feels on his face. Cheeky tongue slip. 11/10 https://t.co/j1zczS0lI5,https://twitter.com/dog_rates/status/676975532580409345/photo/1,11.0,10.0,Cooper,2015-12-16,04:01:59,,https://pbs.twimg.com/media/CWUZpydWcAAeipD.jpg,malamute,2812,1090
6.769578600860959e+17,2015-12-16 02:51:45+00:00,Twitter for iPhone,10/10 I'd follow this dog into battle no questions asked https://t.co/ngTNXYQF0L,https://twitter.com/dog_rates/status/676957860086095872/video/1,10.0,10.0,,2015-12-16,02:51:45,,https://pbs.twimg.com/ext_tw_video_thumb/676957802976419840/pu/img/dCj-qlXo73A5hf6Q.jpg,labrador_retriever,2252,818
6.769496327742341e+17,2015-12-16 02:19:04+00:00,Twitter for iPhone,This is Tyrus. He's a Speckled Centennial Ticonderoga. Terrified of floating red ball. Nifty bandana. 8/10 v petable https://t.co/HqM3YhCaaa,https://twitter.com/dog_rates/status/676949632774234114/photo/1,8.0,10.0,Tyrus,2015-12-16,02:19:04,,https://pbs.twimg.com/media/CWUCGMtWEAAjXnS.jpg,welsh_springer_spaniel,1324,398
6.769482364778578e+17,2015-12-16 02:13:31+00:00,Twitter for iPhone,This is Karl. Karl thinks he's slick. 6/10 sneaky pup https://t.co/Lo4ALwjVh4,https://twitter.com/dog_rates/status/676948236477857792/photo/1,6.0,10.0,Karl,2015-12-16,02:13:31,,https://pbs.twimg.com/media/CWUA1GFW4AAowiq.jpg,,2200,871
6.769468644790845e+17,2015-12-16 02:08:04+00:00,Twitter for iPhone,This pups goal was to get all four feet as close to each other as possible. Valiant effort 12/10 https://t.co/2mXALbgBTV,https://twitter.com/dog_rates/status/676946864479084545/photo/1,12.0,10.0,,2015-12-16,02:08:04,,https://pbs.twimg.com/media/CWT_lOQWUAAXPaY.jpg,pekinese,1742,376
6.769424280001126e+17,2015-12-16 01:50:26+00:00,Twitter for iPhone,Who leaves the last cupcake just sitting there? 9/10 https://t.co/PWMqAoEx2a,https://twitter.com/dog_rates/status/676942428000112642/photo/1,9.0,10.0,,2015-12-16,01:50:26,,https://pbs.twimg.com/media/CWT7imQXIAMwpQ2.jpg,,2098,763
6.769365419361853e+17,2015-12-16 01:27:03+00:00,Twitter for iPhone,Here we see a rare pouched pupper. Ample storage space. Looks alert. Jumps at random. Kicked open that door. 8/10 https://t.co/mqvaxleHRz,https://twitter.com/dog_rates/status/676936541936185344/photo/1,8.0,10.0,,2015-12-16,01:27:03,pupper,https://pbs.twimg.com/media/CWT2MUgWIAECWig.jpg,chesapeake_bay_retriever,12854,4975
6.76897532954456e+17,2015-12-15 22:52:02+00:00,Twitter for iPhone,Exotic handheld dog here. Appears unathletic. Feet look deadly. Can be thrown a great distance. 5/10 might pet idk https://t.co/Avq4awulqk,https://twitter.com/dog_rates/status/676897532954456065/photo/1,5.0,10.0,,2015-12-15,22:52:02,,https://pbs.twimg.com/media/CWTSt0UW4AALMNB.jpg,,2276,726
6.768645016150426e+17,2015-12-15 20:40:47+00:00,Twitter for iPhone,Meet Ash. He's just a head now. Lost his body during the Third Crusade. Still in good spirits. 10/10 would pet well https://t.co/NJj2uP0atK,https://twitter.com/dog_rates/status/676864501615042560/photo/1,10.0,10.0,Ash,2015-12-15,20:40:47,,https://pbs.twimg.com/media/CWS0q8iU8AE2Srr.jpg,chesapeake_bay_retriever,2125,718
6.768219580430336e+17,2015-12-15 17:51:44+00:00,Twitter for iPhone,Finally some constructive political change in this country. 11/10 https://t.co/mvQaETHVSb,"https://twitter.com/dog_rates/status/676821958043033607/photo/1,https://twitter.com/dog_rates/status/676821958043033607/photo/1",11.0,10.0,,2015-12-15,17:51:44,,https://pbs.twimg.com/media/CWSN-vaXAAA8Ehr.jpg,great_pyrenees,23271,15803
6.768196510667325e+17,2015-12-15 17:42:34+00:00,Twitter for iPhone,Watch out Airbud. This pupper is also good at the sports. 12/10 I'm thinking D1 https://t.co/1HrFdo7M0C,"https://twitter.com/dog_rates/status/676819651066732545/photo/1,https://twitter.com/dog_rates/status/676819651066732545/photo/1",12.0,10.0,,2015-12-15,17:42:34,pupper,https://pbs.twimg.com/media/CWSL4W8WsAAE4KU.jpg,labrador_retriever,1826,678
6.768117467079188e+17,2015-12-15 17:11:09+00:00,Twitter for iPhone,Say hello to Penny &amp; Gizmo. They are practicing their caroling. The ambition in the room is tangible. 9/10 for both https://t.co/aqBHjjh5VD,https://twitter.com/dog_rates/status/676811746707918848/photo/1,9.0,10.0,,2015-12-15,17:11:09,,https://pbs.twimg.com/media/CWSEsO9WwAAX-fZ.jpg,chihuahua,1433,429
6.76776431406465e+17,2015-12-15 14:50:49+00:00,Twitter for iPhone,"When someone yells ""cops!"" at a party and you gotta get your drunk friend out of there. 10/10 https://t.co/4rMZi5Ca1k",https://twitter.com/dog_rates/status/676776431406465024/video/1,10.0,10.0,,2015-12-15,14:50:49,,https://pbs.twimg.com/ext_tw_video_thumb/676776408941662209/pu/img/k-6I3YEZAQtYPBXR.jpg,,5054,2045
6.766175037626819e+17,2015-12-15 04:19:18+00:00,Twitter for iPhone,I promise this wasn't meant to be a cuteness overload account but ermergerd look at this cozy pupper. 13/10 https://t.co/mpQl2rJjDh,https://twitter.com/dog_rates/status/676617503762681856/photo/1,13.0,10.0,,2015-12-15,04:19:18,pupper,https://pbs.twimg.com/media/CWPUB9TWwAALPPx.jpg,chihuahua,2927,985
