tweet_id,timestamp,source,text,expanded_urls,rating_numerator,rating_denominator,name,date,time,dog_stage,jpg_url,dog_breed,favorite_count,retweet_count
7.920500631534387e+17,2016-10-28 17:07:05+00:00,Twitter for iPhone,This is Remus. He's a mop that came to life. Can't see anything. Constantly trips over himself. Still a very good dog. 11/10 https://t.co/S3f1SYylzu,"https://twitter.com/dog_rates/status/792050063153438720/photo/1,https://twitter.com/dog_rates/status/792050063153438720/photo/1",11.0,10.0,Remus,2016-10-28,17:07:05,,https://pbs.twimg.com/media/Cv3tU38WcAASFas.jpg,komondor,7513,1908
7.916723228476375e+17,2016-10-27 16:06:04+00:00,Twitter for iPhone,When she says you're a good boy and you know you're a good boy because you're a good boy. 13/10 https://t.co/O5IUmRHRIh,https://twitter.com/dog_rates/status/791672322847637504/photo/1,13.0,10.0,,2016-10-27,16:06:04,,https://pbs.twimg.com/media/CvyVxQRWEAAdSZS.jpg,golden_retriever,12303,3306
7.914069556843684e+17,2016-10-26 22:31:36+00:00,Twitter for iPhone,Say hello to Levi. He's a Madagascan Butterbop. One of the more docile Butterbops I've seen. 12/10 would give all the pets https://t.co/Zcw9Sccctc,"https://twitter.com/dog_rates/status/791406955684368384/photo/1,https://twitter.com/dog_rates/status/791406955684368384/photo/1,https://twitter.com/dog_rates/status/791406955684368384/photo/1,https://twitter.com/dog_rates/status/791406955684368384/photo/1",12.0,10.0,,2016-10-26,22:31:36,,https://pbs.twimg.com/media/CvukbEkWAAAV-69.jpg,pembroke,13748,4352
7.913121591836344e+17,2016-10-26 16:14:55+00:00,Twitter for iPhone,This is Mabel. She's super h*ckin smol. Portable af. Comes with the smol shoe. 12/10 would keep in frocket https://t.co/GGJvxYt3xK,"https://twitter.com/dog_rates/status/791312159183634433/photo/1,https://twitter.com/dog_rates/status/791312159183634433/photo/1,https://twitter.com/dog_rates/status/791312159183634433/photo/1,https://twitter.com/dog_rates/status/791312159183634433/photo/1",12.0,10.0,Mabel,2016-10-26,16:14:55,,https://pbs.twimg.com/media/CvtONV4WAAAQ3Rn.jpg,miniature_pinscher,9193,2676
7.909874261310505e+17,2016-10-25 18:44:32+00:00,Twitter for iPhone,This is Misty. She has a cowboy hat on her nose. 12/10 https://t.co/Eno0mypHIr,https://twitter.com/dog_rates/status/790987426131050500/photo/1,12.0,10.0,Misty,2016-10-25,18:44:32,,https://pbs.twimg.com/media/Cvom3ZJXEAE29TD.jpg,cocker_spaniel,10336,2246
7.90946055508652e+17,2016-10-25 16:00:09+00:00,Twitter for iPhone,This is Betty. She's assisting with the dishes. Such a good puppo. 12/10 h*ckin helpful af https://t.co/dgvTPZ9tgI,https://twitter.com/dog_rates/status/790946055508652032/photo/1,12.0,10.0,Betty,2016-10-25,16:00:09,puppo,https://pbs.twimg.com/media/CvoBPWRWgAA4het.jpg,golden_retriever,17441,4947
7.906987551713649e+17,2016-10-24 23:37:28+00:00,Twitter for iPhone,This is Mosby. He appears to be rather h*ckin snuggable af. 12/10 keep it up Mosby https://t.co/IiiBq460I7,https://twitter.com/dog_rates/status/790698755171364864/photo/1,12.0,10.0,Mosby,2016-10-24,23:37:28,,https://pbs.twimg.com/media/CvkgUjbUsAEvo7l.jpg,bernese_mountain_dog,8590,2027
7.905819494254756e+17,2016-10-24 15:53:19+00:00,Twitter for iPhone,This is Duke. He sneaks into the fridge sometimes. It's his safe place. 11/10 would give little jacket if necessary https://t.co/Fd5WFDTMH4,"https://twitter.com/dog_rates/status/790581949425475584/photo/1,https://twitter.com/dog_rates/status/790581949425475584/photo/1",11.0,10.0,Duke,2016-10-24,15:53:19,,https://pbs.twimg.com/media/Cvi2FiKWgAAif1u.jpg,malinois,21664,7571
7.903375896770028e+17,2016-10-23 23:42:19+00:00,Twitter for iPhone,Meet Maggie. She can hear your cells divide. 12/10 can also probably fly https://t.co/ovE2hqXryV,https://twitter.com/dog_rates/status/790337589677002753/photo/1,12.0,10.0,Maggie,2016-10-23,23:42:19,,https://pbs.twimg.com/media/CvfX2AnWYAAQTay.jpg,pembroke,8187,1977
7.902771173469757e+17,2016-10-23 19:42:02+00:00,Twitter for iPhone,This is Bruce. He never backs down from a challenge. 11/10 you got this Bruce https://t.co/aI7umZHIq7,https://twitter.com/dog_rates/status/790277117346975746/photo/1,11.0,10.0,Bruce,2016-10-23,19:42:02,,https://pbs.twimg.com/media/Cveg1-NXgAASaaT.jpg,labrador_retriever,13149,3352
7.899864660510884e+17,2016-10-23 00:27:05+00:00,Twitter for iPhone,This is Happy. He's a bathtub reviewer. Seems to be pleased with this one. 12/10 https://t.co/Ln89R4FP7v,https://twitter.com/dog_rates/status/789986466051088384/photo/1,12.0,10.0,Happy,2016-10-23,00:27:05,,https://pbs.twimg.com/media/CvaYgDOWgAEfjls.jpg,golden_retriever,9678,2447
7.896286580550205e+17,2016-10-22 00:45:17+00:00,Twitter for iPhone,This is Eli. He can fly. 13/10 magical af https://t.co/huPSJJ7FDI,https://twitter.com/dog_rates/status/789628658055020548/photo/1,13.0,10.0,Eli,2016-10-22,00:45:17,,https://pbs.twimg.com/media/CvVTEnPXYAAWLyL.jpg,chow,7866,1875
7.895992420798382e+17,2016-10-21 22:48:24+00:00,Twitter for iPhone,This is Brownie. She's wearing a Halloween themed onesie. 12/10 festive af https://t.co/0R4meWXFOx,"https://twitter.com/dog_rates/status/789599242079838210/photo/1,https://twitter.com/dog_rates/status/789599242079838210/photo/1",12.0,10.0,Brownie,2016-10-21,22:48:24,,https://pbs.twimg.com/media/CvU4UZpXgAE1pAV.jpg,chesapeake_bay_retriever,7079,2027
7.895308770133934e+17,2016-10-21 18:16:44+00:00,Twitter for iPhone,This is Rizzy. She smiles a lot. 12/10 contagious af https://t.co/TU4sZogVIq,"https://twitter.com/dog_rates/status/789530877013393408/photo/1,https://twitter.com/dog_rates/status/789530877013393408/photo/1,https://twitter.com/dog_rates/status/789530877013393408/photo/1",12.0,10.0,Rizzy,2016-10-21,18:16:44,,https://pbs.twimg.com/media/CvT6IV6WEAQhhV5.jpg,schipperke,12324,3558
7.892684487487037e+17,2016-10-21 00:53:56+00:00,Twitter for iPhone,This is Stella. She's happier than I will ever be. 10/10 would trade lives with https://t.co/JSs2bfDtTS,https://twitter.com/dog_rates/status/789268448748703744/photo/1,10.0,10.0,Stella,2016-10-21,00:53:56,,https://pbs.twimg.com/media/CvQLdotWcAAZn86.jpg,malamute,9529,2744
7.891379620680212e+17,2016-10-20 16:15:26+00:00,Twitter for iPhone,This is Bo. He's a West Congolese Bugaboop Snuggle. Rather exotic. Master of the head tilt. 12/10 would pay to pet https://t.co/2jwxxtNzoN,"https://twitter.com/dog_rates/status/789137962068021249/photo/1,https://twitter.com/dog_rates/status/789137962068021249/photo/1,https://twitter.com/dog_rates/status/789137962068021249/photo/1",12.0,10.0,Bo,2016-10-20,16:15:26,,https://pbs.twimg.com/media/CvOUw8vWYAAzJDq.jpg,chihuahua,10164,2951
7.889083869434307e+17,2016-10-20 01:03:11+00:00,Twitter for iPhone,"This is Lucy. She destroyed not one, but two remotes trying to turn off the debate. 11/10 relatable af https://t.co/3BXh073tDm",https://twitter.com/dog_rates/status/788908386943430656/photo/1,11.0,10.0,Lucy,2016-10-20,01:03:11,,https://pbs.twimg.com/media/CvLD-mbWYAAFI8w.jpg,golden_retriever,28690,13112
7.887659149929021e+17,2016-10-19 15:37:03+00:00,Twitter for iPhone,This is Butter. She can have whatever she wants forever. 12/10 would hug softly https://t.co/x5gXRS1abq,https://twitter.com/dog_rates/status/788765914992902144/photo/1,12.0,10.0,Butter,2016-10-19,15:37:03,,https://pbs.twimg.com/media/CvJCabcWgAIoUxW.jpg,cocker_spaniel,28698,10873
7.884121440186614e+17,2016-10-18 16:11:17+00:00,Twitter for iPhone,This is Dexter. He breaks hearts for a living. 11/10 h*ckin handsome af https://t.co/4DhSsC1W7S,"https://twitter.com/dog_rates/status/788412144018661376/photo/1,https://twitter.com/dog_rates/status/788412144018661376/photo/1",11.0,10.0,Dexter,2016-10-18,16:11:17,,https://pbs.twimg.com/media/CvEAqQoWgAADj5K.jpg,golden_retriever,16295,5555
7.881782686629847e+17,2016-10-18 00:41:57+00:00,Twitter for iPhone,Atlas is back and this time he's got doggles. Still 13/10 solarly conscious af https://t.co/s7MgFWDySc,"https://twitter.com/dog_rates/status/788178268662984705/photo/1,https://twitter.com/dog_rates/status/788178268662984705/photo/1,https://twitter.com/dog_rates/status/788178268662984705/photo/1,https://twitter.com/dog_rates/status/788178268662984705/photo/1",13.0,10.0,,2016-10-18,00:41:57,,https://pbs.twimg.com/media/CvAr88kW8AEKNAO.jpg,samoyed,7568,2216
7.881505855770501e+17,2016-10-17 22:51:57+00:00,Twitter for iPhone,This is Leo. He's a golden chow. Rather h*ckin rare. 13/10 would give extra pats https://t.co/xosHjFzVXc,"https://twitter.com/dog_rates/status/788150585577050112/photo/1,https://twitter.com/dog_rates/status/788150585577050112/photo/1,https://twitter.com/dog_rates/status/788150585577050112/photo/1,https://twitter.com/dog_rates/status/788150585577050112/photo/1",13.0,10.0,Leo,2016-10-17,22:51:57,,https://pbs.twimg.com/media/CvASw6dWcAQmo3X.jpg,chow,6419,1363
7.880396374534062e+17,2016-10-17 15:31:05+00:00,Twitter for iPhone,Did... did they pick out that license plate? 12/10 for both https://t.co/lRmUUOxgbQ,"https://twitter.com/dog_rates/status/788039637453406209/photo/1,https://twitter.com/dog_rates/status/788039637453406209/photo/1",12.0,10.0,,2016-10-17,15:31:05,,https://pbs.twimg.com/media/Cu-t20yWEAAFHXi.jpg,,6430,1391
7.878105525926953e+17,2016-10-17 00:20:47+00:00,Twitter for iPhone,This is Frank. He wears sunglasses and walks himself. 11/10 I'll never be this cool or independent https://t.co/pNNjBtHWPc,"https://twitter.com/dog_rates/status/787810552592695296/photo/1,https://twitter.com/dog_rates/status/787810552592695296/photo/1",11.0,10.0,Frank,2016-10-17,00:20:47,,https://pbs.twimg.com/media/Cu7dg2RXYAIaGXE.jpg,pug,9076,3231
7.877176037416223e+17,2016-10-16 18:11:26+00:00,Twitter for iPhone,This is Tonks. She is a service puppo. Can hear a caterpillar hiccup from 7 miles away. 13/10 would follow anywhere https://t.co/i622ZbWkUp,"https://twitter.com/dog_rates/status/787717603741622272/photo/1,https://twitter.com/dog_rates/status/787717603741622272/photo/1,https://twitter.com/dog_rates/status/787717603741622272/photo/1,https://twitter.com/dog_rates/status/787717603741622272/photo/1",13.0,10.0,Tonks,2016-10-16,18:11:26,puppo,https://pbs.twimg.com/media/Cu6I9vvWIAAZG0a.jpg,german_shepherd,10703,2927
7.87397959788929e+17,2016-10-15 21:01:17+00:00,Twitter for iPhone,This is Moose. He's rather h*ckin dangerous (you can tell by the collar). 11/10 would still attempt to snug https://t.co/lHVHGdDzb3,https://twitter.com/dog_rates/status/787397959788929025/photo/1,11.0,10.0,Moose,2016-10-15,21:01:17,,https://pbs.twimg.com/media/Cu1mQsDWEAAU_VQ.jpg,chihuahua,11362,2993
7.873224439458775e+17,2016-10-15 16:01:13+00:00,Twitter for iPhone,This is Lincoln. He forgot to use his blinker when he changed lanes just now. Guilty as h*ck. Still 10/10 https://t.co/lsrR83SiVp,https://twitter.com/dog_rates/status/787322443945877504/photo/1,10.0,10.0,Lincoln,2016-10-15,16:01:13,,https://pbs.twimg.com/media/Cu0hlfwWYAEdnXO.jpg,golden_retriever,8149,1838
7.869630643735347e+17,2016-10-14 16:13:10+00:00,Twitter for iPhone,This is Rory. He's got an interview in a few minutes. Looking spiffy af. Nervous as h*ck tho. 12/10 would hire https://t.co/ibj5g6xaAj,https://twitter.com/dog_rates/status/786963064373534720/photo/1,12.0,10.0,Rory,2016-10-14,16:13:10,,https://pbs.twimg.com/media/Cuvau3MW8AAxaRv.jpg,golden_retriever,27835,8391
7.867090828498289e+17,2016-10-13 23:23:56+00:00,Twitter for iPhone,"This is Logan, the Chow who lived. He solemnly swears he's up to lots of good. H*ckin magical af 9.75/10 https://t.co/yBO5wuqaPS",https://twitter.com/dog_rates/status/786709082849828864/photo/1,9.75,10.0,Logan,2016-10-13,23:23:56,,https://pbs.twimg.com/media/CurzvFTXgAA2_AP.jpg,pomeranian,19067,6430
7.866649550430495e+17,2016-10-13 20:28:35+00:00,Twitter for iPhone,"""Honestly Kathleen I just want more Ken Bone"" 12/10 https://t.co/HmlEvAMP4r",https://twitter.com/dog_rates/status/786664955043049472/photo/1,12.0,10.0,,2016-10-13,20:28:35,,https://pbs.twimg.com/media/CurLmoqXgAEPoJ-.jpg,leonberg,11121,2688
7.865959702933709e+17,2016-10-13 15:54:28+00:00,Twitter for iPhone,This is Dale. He's a real spookster. Did me quite the frighten. 11/10 not too spooky to pet tho https://t.co/L8BWDD4oBX,https://twitter.com/dog_rates/status/786595970293370880/photo/1,11.0,10.0,Dale,2016-10-13,15:54:28,,https://pbs.twimg.com/media/CuqM0fVWAAAboKR.jpg,pembroke,9841,3280
7.863632357463859e+17,2016-10-13 00:29:39+00:00,Twitter for iPhone,This is Rizzo. He has many talents. A true renaissance doggo. 13/10 entertaining af https://t.co/TVXpEJB7Wn,"https://twitter.com/dog_rates/status/786363235746385920/photo/1,https://twitter.com/dog_rates/status/786363235746385920/photo/1,https://twitter.com/dog_rates/status/786363235746385920/photo/1,https://twitter.com/dog_rates/status/786363235746385920/photo/1",13.0,10.0,Rizzo,2016-10-13,00:29:39,doggo,https://pbs.twimg.com/media/Cum5LlfWAAAyPcS.jpg,golden_retriever,11396,3692
7.862339652418273e+17,2016-10-12 15:55:59+00:00,Twitter for iPhone,This is Mattie. She's extremely dangerous. Will bite your h*ckin finger right off. Still 11/10 would pet with caution https://t.co/78c9W8kLFh,https://twitter.com/dog_rates/status/786233965241827333/photo/1,11.0,10.0,Mattie,2016-10-12,15:55:59,,https://pbs.twimg.com/media/CulDnZpWcAAGbZ-.jpg,labrador_retriever,15979,5017
7.859278191760548e+17,2016-10-11 19:39:28+00:00,Twitter for iPhone,This is Lucy. She's strives to be the best potato she can be. 12/10 would boop https://t.co/lntsj7Fc4Y,https://twitter.com/dog_rates/status/785927819176054784/photo/1,12.0,10.0,Lucy,2016-10-11,19:39:28,,https://pbs.twimg.com/media/CugtKeXWEAAamDZ.jpg,toy_poodle,11901,3339
7.85872687017132e+17,2016-10-11 16:00:24+00:00,Twitter for iPhone,Meet Rusty. He appears to be rather h*ckin fluffy. Also downright adorable af. 12/10 would rub my face against his https://t.co/1j9kLGb4wV,https://twitter.com/dog_rates/status/785872687017132033/video/1,12.0,10.0,Rusty,2016-10-11,16:00:24,,https://pbs.twimg.com/ext_tw_video_thumb/785872596088811520/pu/img/5O-_BgqdFQu_2Bt7.jpg,great_pyrenees,6995,1921
7.85639753186218e+17,2016-10-11 00:34:48+00:00,Twitter for iPhone,This is Pinot. He's a sophisticated doggo. You can tell by the hat. Also pointier than your average pupper. Still 10/10 would pet cautiously https://t.co/f2wmLZTPHd,"https://twitter.com/dog_rates/status/785639753186217984/photo/1,https://twitter.com/dog_rates/status/785639753186217984/photo/1",10.0,10.0,Pinot,2016-10-11,00:34:48,doggo,https://pbs.twimg.com/media/CucnLmeWAAALOSC.jpg,,8175,2341
7.85639753186218e+17,2016-10-11 00:34:48+00:00,Twitter for iPhone,This is Pinot. He's a sophisticated doggo. You can tell by the hat. Also pointier than your average pupper. Still 10/10 would pet cautiously https://t.co/f2wmLZTPHd,"https://twitter.com/dog_rates/status/785639753186217984/photo/1,https://twitter.com/dog_rates/status/785639753186217984/photo/1",10.0,10.0,Pinot,2016-10-11,00:34:48,pupper,https://pbs.twimg.com/media/CucnLmeWAAALOSC.jpg,,8175,2341
7.85533386513322e+17,2016-10-10 17:32:08+00:00,Twitter for iPhone,This is Dallas. Her tongue is ridiculous. 11/10 h*ckin proud af https://t.co/h4jhlH4EyG,"https://twitter.com/dog_rates/status/785533386513321988/photo/1,https://twitter.com/dog_rates/status/785533386513321988/photo/1",11.0,10.0,Dallas,2016-10-10,17:32:08,,https://pbs.twimg.com/media/CubGchjXEAA6gpw.jpg,miniature_pinscher,9522,2099
7.852647542479954e+17,2016-10-09 23:44:41+00:00,Twitter for iPhone,This is Doc. He requested to be carried around like that. 12/10 anything for Doc https://t.co/mWYACm4qnx,https://twitter.com/dog_rates/status/785264754247995392/photo/1,12.0,10.0,Doc,2016-10-09,23:44:41,,https://pbs.twimg.com/media/CuXSHNnWcAIWEwn.jpg,chow,7584,1714
7.851709366223503e+17,2016-10-09 17:31:53+00:00,Twitter for iPhone,This is Hero. He was enjoying the car ride until he remembered that bees are dying globally at an alarming rate. 11/10 https://t.co/cubFg7F4qQ,"https://twitter.com/dog_rates/status/785170936622350336/photo/1,https://twitter.com/dog_rates/status/785170936622350336/photo/1,https://twitter.com/dog_rates/status/785170936622350336/photo/1,https://twitter.com/dog_rates/status/785170936622350336/photo/1",11.0,10.0,Hero,2016-10-09,17:31:53,,https://pbs.twimg.com/media/CuV8yfxXEAAUlye.jpg,eskimo_dog,12601,5097
7.848260202937098e+17,2016-10-08 18:41:19+00:00,Twitter for iPhone,This is Rusty. He's going D1 for sure. Insane vertical. 13/10 would draft https://t.co/AsykOwMrXQ,https://twitter.com/dog_rates/status/784826020293709826/photo/1,13.0,10.0,Rusty,2016-10-08,18:41:19,,https://pbs.twimg.com/media/CuRDF-XWcAIZSer.jpg,chow,10579,3399
7.845175183712215e+17,2016-10-07 22:15:26+00:00,Twitter for iPhone,This is Frankie. He has yet to learn how to control his tongue. 11/10 maybe one day https://t.co/p6fgYe2dB6,"https://twitter.com/dog_rates/status/784517518371221505/photo/1,https://twitter.com/dog_rates/status/784517518371221505/photo/1,https://twitter.com/dog_rates/status/784517518371221505/photo/1",11.0,10.0,Frankie,2016-10-07,22:15:26,,https://pbs.twimg.com/media/CuMqhGrXYAQwRqU.jpg,malamute,9356,2664
7.844314304116859e+17,2016-10-07 16:33:21+00:00,Twitter for iPhone,This is Stormy. He's curly af. Already pupared for Coachella next year. 12/10 https://t.co/PHA1vtqqpt,https://twitter.com/dog_rates/status/784431430411685888/photo/1,12.0,10.0,Stormy,2016-10-07,16:33:21,,https://pbs.twimg.com/media/CuLcNkCXgAEIwK2.jpg,miniature_poodle,5950,1349
7.838399664052306e+17,2016-10-06 01:23:05+00:00,Twitter for iPhone,This is Riley. His owner put a donut pillow around him and he loves it so much he won't let anyone take it off. 13/10 https://t.co/8TCQcsZCZ8,"https://twitter.com/dog_rates/status/783839966405230592/photo/1,https://twitter.com/dog_rates/status/783839966405230592/photo/1,https://twitter.com/dog_rates/status/783839966405230592/photo/1",13.0,10.0,Riley,2016-10-06,01:23:05,,https://pbs.twimg.com/media/CuDCSM-XEAAJw1W.jpg,,31350,11322
7.838211070611988e+17,2016-10-06 00:08:09+00:00,Twitter for iPhone,This is Mairi. She has mastered the art of camouflage. 12/10 h*ckin sneaky af https://t.co/STcPjiNAHp,"https://twitter.com/dog_rates/status/783821107061198850/photo/1,https://twitter.com/dog_rates/status/783821107061198850/photo/1",12.0,10.0,Mairi,2016-10-06,00:08:09,,https://pbs.twimg.com/media/CuCxIzyWEAQTnQA.jpg,lakeland_terrier,7677,2060
7.836951018013983e+17,2016-10-05 15:47:27+00:00,Twitter for iPhone,This is Loomis. He's the leader of the Kenneth search party. The passion is almost overwhelming. 12/10 one day he will be free https://t.co/kCRKlFg4AY,"https://twitter.com/dog_rates/status/783695101801398276/photo/1,https://twitter.com/dog_rates/status/783695101801398276/photo/1,https://twitter.com/dog_rates/status/783695101801398276/photo/1",12.0,10.0,Loomis,2016-10-05,15:47:27,,https://pbs.twimg.com/media/CuA-iRHXYAAWP8e.jpg,chow,10908,3370
7.834667721670984e+17,2016-10-05 00:40:09+00:00,Twitter for iPhone,This is Finn. He likes eavesdropping from filing cabinets. It's a real issue but no one has approached him about it. 11/10 would still pet https://t.co/s8W8Del9HQ,"https://twitter.com/dog_rates/status/783466772167098368/photo/1,https://twitter.com/dog_rates/status/783466772167098368/photo/1",11.0,10.0,Finn,2016-10-05,00:40:09,,https://pbs.twimg.com/media/Ct9u3ljW8AEnVIm.jpg,chihuahua,8821,2359
7.8339175372655e+17,2016-10-04 19:42:03+00:00,Twitter for iPhone,Meet Godi. He's an avid beachgoer and part time rainbow summoner. Eyeliner flawless af. 13/10 would snug well https://t.co/BO936YdJdi,"https://twitter.com/dog_rates/status/783391753726550016/photo/1,https://twitter.com/dog_rates/status/783391753726550016/photo/1,https://twitter.com/dog_rates/status/783391753726550016/photo/1,https://twitter.com/dog_rates/status/783391753726550016/photo/1",13.0,10.0,Godi,2016-10-04,19:42:03,,https://pbs.twimg.com/media/Ct8qn8EWIAAk9zP.jpg,norwegian_elkhound,17612,5773
7.833346399853896e+17,2016-10-04 15:55:06+00:00,Twitter for iPhone,This is Dave. He's currently in a predicament. Doesn't seem to mind tho. 12/10 someone assist Dave https://t.co/nfprKAXqwu,"https://twitter.com/dog_rates/status/783334639985389568/photo/1,https://twitter.com/dog_rates/status/783334639985389568/photo/1,https://twitter.com/dog_rates/status/783334639985389568/photo/1",12.0,10.0,Dave,2016-10-04,15:55:06,,https://pbs.twimg.com/media/Ct72q9jWcAAhlnw.jpg,cardigan,30455,12286
7.830857039745147e+17,2016-10-03 23:25:55+00:00,Twitter for iPhone,This is Earl. He can't catch. Did his best tho. 11/10 would repair confidence with extra pats https://t.co/IsqyvbjFgM,"https://twitter.com/dog_rates/status/783085703974514689/photo/1,https://twitter.com/dog_rates/status/783085703974514689/photo/1",11.0,10.0,Earl,2016-10-03,23:25:55,,https://pbs.twimg.com/media/Ct4URfWUAAQ7lKe.jpg,chesapeake_bay_retriever,8508,2329
7.829691400091075e+17,2016-10-03 15:42:44+00:00,Twitter for iPhone,This is Cali. She arrived preassembled. Convenient af. 12/10 appears to be rather h*ckin pettable https://t.co/vOBV1ZqVcX,"https://twitter.com/dog_rates/status/782969140009107456/photo/1,https://twitter.com/dog_rates/status/782969140009107456/photo/1",12.0,10.0,Cali,2016-10-03,15:42:44,,https://pbs.twimg.com/media/Ct2qO5PXEAE6eB0.jpg,golden_retriever,25184,7731
7.827471345295319e+17,2016-10-03 01:00:34+00:00,Twitter for iPhone,This is Deacon. He's the happiest almost dry doggo I've ever seen. 11/10 would smile back https://t.co/C6fUMnHt1H,https://twitter.com/dog_rates/status/782747134529531904/photo/1,11.0,10.0,Deacon,2016-10-03,01:00:34,doggo,https://pbs.twimg.com/media/CtzgXgeXYAA1Gxw.jpg,golden_retriever,7796,1472
7.827225987907256e+17,2016-10-02 23:23:04+00:00,Twitter for iPhone,"This is Penny. She fought a bee and the bee won. 10/10 you're fine Penny, everything's fine https://t.co/zrMVdfFej6",https://twitter.com/dog_rates/status/782722598790725632/photo/1,10.0,10.0,Penny,2016-10-02,23:23:04,,https://pbs.twimg.com/media/CtzKC7zXEAALfSo.jpg,irish_setter,18013,5663
7.825986401371873e+17,2016-10-02 15:10:30+00:00,Twitter for iPhone,This is Timmy. He's quite large. According to a trusted source it's actually a dog wearing a dog suit. 11/10 https://t.co/BIUchFwHqn,https://twitter.com/dog_rates/status/782598640137187329/photo/1,11.0,10.0,Timmy,2016-10-02,15:10:30,,https://pbs.twimg.com/media/CtxZTtxUMAEduGo.jpg,malamute,8128,1974
7.82305867769217e+17,2016-10-01 19:47:08+00:00,Twitter for iPhone,This is Sampson. He just graduated. Ready to be a doggo now. Time for the real world. 12/10 have fun with taxes https://t.co/pgVKxRw0s1,"https://twitter.com/dog_rates/status/782305867769217024/photo/1,https://twitter.com/dog_rates/status/782305867769217024/photo/1,https://twitter.com/dog_rates/status/782305867769217024/photo/1",12.0,10.0,Sampson,2016-10-01,19:47:08,doggo,https://pbs.twimg.com/media/CttPBt0WIAAcsDE.jpg,briard,17386,5852
7.819552034446991e+17,2016-09-30 20:33:43+00:00,Twitter for iPhone,This is Chipson. He weighed in at .3 ounces and is officially super h*ckin smol. Space-saving af. 11/10 would snug delicately https://t.co/FjEsk7A1JV,https://twitter.com/dog_rates/status/781955203444699136/photo/1,11.0,10.0,Chipson,2016-09-30,20:33:43,,https://pbs.twimg.com/media/CtoQGu4XgAQgv5m.jpg,,11603,3532
7.81661882474197e+17,2016-09-30 01:08:10+00:00,Twitter for iPhone,Who keeps sending in pictures without dogs in them? This needs to stop. 5/10 for the mediocre road https://t.co/ELqelxWMrC,https://twitter.com/dog_rates/status/781661882474196992/photo/1,5.0,10.0,,2016-09-30,01:08:10,,https://pbs.twimg.com/media/CtkFS72WcAAiUrs.jpg,pembroke,10905,2847
7.815246933963571e+17,2016-09-29 16:03:01+00:00,Twitter for iPhone,Idk why this keeps happening. We only rate dogs. Not Bangladeshi Couch Chipmunks. Please only send dogs... 12/10 https://t.co/ya7bviQUUf,https://twitter.com/dog_rates/status/781524693396357120/photo/1,12.0,10.0,,2016-09-29,16:03:01,,https://pbs.twimg.com/media/CtiIj0AWcAEBDvw.jpg,chesapeake_bay_retriever,21643,5837
7.812512889903555e+17,2016-09-28 21:56:36+00:00,Twitter for iPhone,This is Oakley. He just got yelled at for going 46 in a 45. Churlish af. 11/10 would still pet so well https://t.co/xIYsa6LPA4,"https://twitter.com/dog_rates/status/781251288990355457/photo/1,https://twitter.com/dog_rates/status/781251288990355457/photo/1",11.0,10.0,Oakley,2016-09-28,21:56:36,,https://pbs.twimg.com/media/CteP5H5WcAEhdLO.jpg,mexican_hairless,8798,2191
7.81163403222057e+17,2016-09-28 16:07:23+00:00,Twitter for iPhone,"We normally don't rate lobsters, but this one appears to be a really good lobster. 10/10 would pet with caution https://t.co/YkHc7U7uUy",https://twitter.com/dog_rates/status/781163403222056960/photo/1,10.0,10.0,,2016-09-28,16:07:23,,https://pbs.twimg.com/media/Ctc_-BTWEAAQpZh.jpg,shetland_sheepdog,10204,2868
7.809316141509837e+17,2016-09-28 00:46:20+00:00,Twitter for iPhone,I want to finally rate this iconic puppo who thinks the parade is all for him. 13/10 would absolutely attend https://t.co/5dUYOu4b8d,https://twitter.com/dog_rates/status/780931614150983680/photo/1,13.0,10.0,,2016-09-28,00:46:20,puppo,https://pbs.twimg.com/media/CtZtJxAXEAAyPGd.jpg,,22542,7698
7.808582890935747e+17,2016-09-27 19:54:58+00:00,Twitter for iPhone,"This is Dash. He's very stylish, but also incredibly unimpressed with the current state of our nation. 10/10 would pet ears first https://t.co/YElO4hvXI6",https://twitter.com/dog_rates/status/780858289093574656/photo/1,10.0,10.0,Dash,2016-09-27,19:54:58,,https://pbs.twimg.com/media/CtYqeNHWgAATqYZ.jpg,chesapeake_bay_retriever,7491,2106
