tweet_id,timestamp,source,text,expanded_urls,rating_numerator,rating_denominator,name,date,time,dog_stage,jpg_url,dog_breed,favorite_count,retweet_count
8.924206435553362e+17,2017-08-01 16:23:56+00:00,Twitter for iPhone,This is Phineas. He's a mystical boy. Only ever appears in the hole of a donut. 13/10 https://t.co/MgUWQ76dJU,https://twitter.com/dog_rates/status/892420643555336193/photo/1,13.0,10.0,Phineas,2017-08-01,16:23:56,,https://pbs.twimg.com/media/DGKD1-bXoAAIAUK.jpg,,37164,7950
8.921774213063434e+17,2017-08-01 00:17:27+00:00,Twitter for iPhone,"This is Tilly. She's just checking pup on you. Hopes you're doing ok. If not, she's available for pats, snugs, boops, the whole bit. 13/10 https://t.co/0Xxu71qeIV",https://twitter.com/dog_rates/status/892177421306343426/photo/1,13.0,10.0,Tilly,2017-08-01,00:17:27,,https://pbs.twimg.com/media/DGGmoV4XsAAUL6n.jpg,chihuahua,31970,5905
8.918151813780849e+17,2017-07-31 00:18:03+00:00,Twitter for iPhone,This is Archie. He is a rare Norwegian Pouncing Corgo. Lives in the tall grass. You never know when one may strike. 12/10 https://t.co/wUnZnhtVJB,https://twitter.com/dog_rates/status/891815181378084864/photo/1,12.0,10.0,Archie,2017-07-31,00:18:03,,https://pbs.twimg.com/media/DGBdLU1WsAANxJ9.jpg,chihuahua,24077,3904
8.916895572798587e+17,2017-07-30 15:58:51+00:00,Twitter for iPhone,This is Darla. She commenced a snooze mid meal. 13/10 happens to the best of us https://t.co/tD36da7qLQ,https://twitter.com/dog_rates/status/891689557279858688/photo/1,13.0,10.0,Darla,2017-07-30,15:58:51,,https://pbs.twimg.com/media/DF_q7IAWsAEuuN8.jpg,labrador_retriever,40486,8097
8.913275589266883e+17,2017-07-29 16:00:24+00:00,Twitter for iPhone,"This is Franklin. He would like you to stop calling him ""cute."" He is a very fierce shark and should be respected as such. 12/10 #BarkWeek https://t.co/AtUZn91f7f","https://twitter.com/dog_rates/status/891327558926688256/photo/1,https://twitter.com/dog_rates/status/891327558926688256/photo/1",12.0,10.0,Franklin,2017-07-29,16:00:24,,https://pbs.twimg.com/media/DF6hr6BUMAAzZgT.jpg,basset,38711,8787
8.910879508758979e+17,2017-07-29 00:08:17+00:00,Twitter for iPhone,Here we have a majestic great white breaching off South Africa's coast. Absolutely h*ckin breathtaking. 13/10 (IG: tucker_marlo) #BarkWeek https://t.co/kQ04fDDRmh,https://twitter.com/dog_rates/status/891087950875897856/photo/1,13.0,10.0,,2017-07-29,00:08:17,,https://pbs.twimg.com/media/DF3HwyEWsAABqE6.jpg,chesapeake_bay_retriever,19461,2919
8.909719131739914e+17,2017-07-28 16:27:12+00:00,Twitter for iPhone,"Meet Jax. He enjoys ice cream so much he gets nervous around it. 13/10 help Jax enjoy more things by clicking below

https://t.co/Zr4hWfAs1H https://t.co/tVJBRMnhxl","https://gofundme.com/ydvmve-surgery-for-jax,https://twitter.com/dog_rates/status/890971913173991426/photo/1",13.0,10.0,Jax,2017-07-28,16:27:12,,https://pbs.twimg.com/media/DF1eOmZXUAALUcq.jpg,appenzeller,11353,1940
8.907291814112379e+17,2017-07-28 00:22:40+00:00,Twitter for iPhone,When you watch your owner call another dog a good boy but then they turn back to you and say you're a great boy. 13/10 https://t.co/v0nONBcwxq,"https://twitter.com/dog_rates/status/890729181411237888/photo/1,https://twitter.com/dog_rates/status/890729181411237888/photo/1",13.0,10.0,,2017-07-28,00:22:40,,https://pbs.twimg.com/media/DFyBahAVwAAhUTd.jpg,pomeranian,62682,17722
8.906091851503124e+17,2017-07-27 16:25:51+00:00,Twitter for iPhone,This is Zoey. She doesn't want to be one of the scary sharks. Just wants to be a snuggly pettable boatpet. 13/10 #BarkWeek https://t.co/9TwLuAGH0b,https://twitter.com/dog_rates/status/890609185150312448/photo/1,13.0,10.0,Zoey,2017-07-27,16:25:51,,https://pbs.twimg.com/media/DFwUU__XcAEpyXI.jpg,irish_terrier,26771,4022
8.902402553491988e+17,2017-07-26 15:59:51+00:00,Twitter for iPhone,This is Cassie. She is a college pup. Studying international doggo communication and stick theory. 14/10 so elegant much sophisticate https://t.co/t1bfwz5S2A,https://twitter.com/dog_rates/status/890240255349198849/photo/1,14.0,10.0,Cassie,2017-07-26,15:59:51,doggo,https://pbs.twimg.com/media/DFrEyVuW0AAO3t9.jpg,pembroke,30668,6918
8.900066081131725e+17,2017-07-26 00:31:25+00:00,Twitter for iPhone,This is Koda. He is a South Australian deckshark. Deceptively deadly. Frighteningly majestic. 13/10 would risk a petting #BarkWeek https://t.co/dVPW0B0Mme,"https://twitter.com/dog_rates/status/890006608113172480/photo/1,https://twitter.com/dog_rates/status/890006608113172480/photo/1",13.0,10.0,Koda,2017-07-26,00:31:25,,https://pbs.twimg.com/media/DFnwSY4WAAAMliS.jpg,samoyed,29502,6883
8.898808964798669e+17,2017-07-25 16:11:53+00:00,Twitter for iPhone,This is Bruno. He is a service shark. Only gets out of the water to assist you. 13/10 terrifyingly good boy https://t.co/u1XPQMl29g,https://twitter.com/dog_rates/status/889880896479866881/photo/1,13.0,10.0,Bruno,2017-07-25,16:11:53,,https://pbs.twimg.com/media/DFl99B1WsAITKsg.jpg,french_bulldog,26763,4688
8.896653883336827e+17,2017-07-25 01:55:32+00:00,Twitter for iPhone,Here's a puppo that seems to be on the fence about something haha no but seriously someone help her. 13/10 https://t.co/BxvuXk0UCm,https://twitter.com/dog_rates/status/889665388333682689/photo/1,13.0,10.0,,2017-07-25,01:55:32,puppo,https://pbs.twimg.com/media/DFi579UWsAAatzw.jpg,pembroke,46195,9428
8.896388375799071e+17,2017-07-25 00:10:02+00:00,Twitter for iPhone,This is Ted. He does his best. Sometimes that's not enough. But it's ok. 12/10 would assist https://t.co/f8dEDcrKSR,"https://twitter.com/dog_rates/status/889638837579907072/photo/1,https://twitter.com/dog_rates/status/889638837579907072/photo/1",12.0,10.0,Ted,2017-07-25,00:10:02,,https://pbs.twimg.com/media/DFihzFfXsAYGDPR.jpg,french_bulldog,26028,4227
8.895311353442099e+17,2017-07-24 17:02:04+00:00,Twitter for iPhone,This is Stuart. He's sporting his favorite fanny pack. Secretly filled with bones only. 13/10 puppared puppo #BarkWeek https://t.co/y70o6h3isq,https://twitter.com/dog_rates/status/889531135344209921/photo/1,13.0,10.0,Stuart,2017-07-24,17:02:04,puppo,https://pbs.twimg.com/media/DFg_2PVW0AEHN3p.jpg,golden_retriever,14532,2117
8.892788419816858e+17,2017-07-24 00:19:32+00:00,Twitter for iPhone,This is Oliver. You're witnessing one of his many brutal attacks. Seems to be playing with his victim. 13/10 fr*ckin frightening #BarkWeek https://t.co/WpHvrQedPb,https://twitter.com/dog_rates/status/889278841981685760/video/1,13.0,10.0,Oliver,2017-07-24,00:19:32,,https://pbs.twimg.com/ext_tw_video_thumb/889278779352338437/pu/img/VlbFB3v8H8VwzVNY.jpg,whippet,24242,5030
8.889172381238313e+17,2017-07-23 00:22:39+00:00,Twitter for iPhone,This is Jim. He found a fren. Taught him how to sit like the good boys. 12/10 for both https://t.co/chxruIOUJN,https://twitter.com/dog_rates/status/888917238123831296/photo/1,12.0,10.0,Jim,2017-07-23,00:22:39,,https://pbs.twimg.com/media/DFYRgsOUQAARGhO.jpg,golden_retriever,27983,4225
8.888049891996713e+17,2017-07-22 16:56:37+00:00,Twitter for iPhone,This is Zeke. He has a new stick. Very proud of it. Would like you to throw it for him without taking it. 13/10 would do my best https://t.co/HTQ77yNQ5K,"https://twitter.com/dog_rates/status/888804989199671297/photo/1,https://twitter.com/dog_rates/status/888804989199671297/photo/1",13.0,10.0,Zeke,2017-07-22,16:56:37,,https://pbs.twimg.com/media/DFWra-3VYAA2piG.jpg,golden_retriever,24582,4000
8.885549627242783e+17,2017-07-22 00:23:06+00:00,Twitter for iPhone,This is Ralphus. He's powering up. Attempting maximum borkdrive. 13/10 inspirational af https://t.co/YnYAFCTTiK,"https://twitter.com/dog_rates/status/888554962724278272/photo/1,https://twitter.com/dog_rates/status/888554962724278272/photo/1,https://twitter.com/dog_rates/status/888554962724278272/photo/1,https://twitter.com/dog_rates/status/888554962724278272/photo/1",13.0,10.0,Ralphus,2017-07-22,00:23:06,,https://pbs.twimg.com/media/DFTH_O-UQAACu20.jpg,siberian_husky,19020,3303
8.880784344585871e+17,2017-07-20 16:49:33+00:00,Twitter for iPhone,This is Gerald. He was just told he didn't get the job he interviewed for. A h*ckin injustice. 12/10 didn't want the job anyway https://t.co/DK7iDPfuRX,"https://twitter.com/dog_rates/status/888078434458587136/photo/1,https://twitter.com/dog_rates/status/888078434458587136/photo/1",12.0,10.0,Gerald,2017-07-20,16:49:33,,https://pbs.twimg.com/media/DFMWn56WsAAkA7B.jpg,french_bulldog,20916,3269
8.877052893818266e+17,2017-07-19 16:06:48+00:00,Twitter for iPhone,This is Jeffrey. He has a monopoly on the pool noodles. Currently running a 'boop for two' midweek sale. 13/10 h*ckin strategic https://t.co/PhrUk20Q64,https://twitter.com/dog_rates/status/887705289381826560/photo/1,13.0,10.0,Jeffrey,2017-07-19,16:06:48,,https://pbs.twimg.com/media/DFHDQBbXgAEqY7t.jpg,basset,29028,5054
8.875171391580938e+17,2017-07-19 03:39:09+00:00,Twitter for iPhone,I've yet to rate a Venezuelan Hover Wiener. This is such an honor. 14/10 paw-inspiring af (IG: roxy.thedoxy) https://t.co/20VrLAA8ba,https://twitter.com/dog_rates/status/887517139158093824/video/1,14.0,10.0,,2017-07-19,03:39:09,,https://pbs.twimg.com/ext_tw_video_thumb/887517108413886465/pu/img/WanJKwssZj4VJvL9.jpg,,44523,11023
8.874739571039519e+17,2017-07-19 00:47:34+00:00,Twitter for iPhone,This is Canela. She attempted some fancy porch pics. They were unsuccessful. 13/10 someone help her https://t.co/cLyzpcUcMX,"https://twitter.com/dog_rates/status/887473957103951883/photo/1,https://twitter.com/dog_rates/status/887473957103951883/photo/1",13.0,10.0,Canela,2017-07-19,00:47:34,,https://pbs.twimg.com/media/DFDw2tyUQAAAFke.jpg,pembroke,66203,16943
8.873432170453688e+17,2017-07-18 16:08:03+00:00,Twitter for iPhone,You may not have known you needed to see this today. 13/10 please enjoy (IG: emmylouroo) https://t.co/WZqNqygEyV,https://twitter.com/dog_rates/status/887343217045368832/video/1,13.0,10.0,,2017-07-18,16:08:03,,https://pbs.twimg.com/ext_tw_video_thumb/887343120832229379/pu/img/6HSuFrW1lzI_9Mht.jpg,mexican_hairless,32357,9820
8.871013928040858e+17,2017-07-18 00:07:08+00:00,Twitter for iPhone,This... is a Jubilant Antarctic House Bear. We only rate dogs. Please only send dogs. Thank you... 12/10 would suffocate in floof https://t.co/4Ad1jzJSdp,https://twitter.com/dog_rates/status/887101392804085760/photo/1,12.0,10.0,,2017-07-18,00:07:08,,https://pbs.twimg.com/media/DE-eAq6UwAA-jaE.jpg,samoyed,29379,5601
8.869832335225446e+17,2017-07-17 16:17:36+00:00,Twitter for iPhone,This is Maya. She's very shy. Rarely leaves her cup. 13/10 would find her an environment to thrive in https://t.co/I6oNy0CgiT,"https://twitter.com/dog_rates/status/886983233522544640/photo/1,https://twitter.com/dog_rates/status/886983233522544640/photo/1",13.0,10.0,Maya,2017-07-17,16:17:36,,https://pbs.twimg.com/media/DE8yicJW0AAAvBJ.jpg,chihuahua,33702,7219
8.867368805193196e+17,2017-07-16 23:58:41+00:00,Twitter for iPhone,"This is Mingus. He's a wonderful father to his smol pup. Confirmed 13/10, but he needs your help

https://t.co/bVi0Yr4Cff https://t.co/ISvKOSkd5b","https://www.gofundme.com/mingusneedsus,https://twitter.com/dog_rates/status/886736880519319552/photo/1,https://twitter.com/dog_rates/status/886736880519319552/photo/1",13.0,10.0,Mingus,2017-07-16,23:58:41,,https://pbs.twimg.com/media/DE5Se8FXcAAJFx4.jpg,kuvasz,11557,3047
8.866803364779336e+17,2017-07-16 20:14:00+00:00,Twitter for iPhone,This is Derek. He's late for a dog meeting. 13/10 pet...al to the metal https://t.co/BCoWue0abA,https://twitter.com/dog_rates/status/886680336477933568/photo/1,13.0,10.0,Derek,2017-07-16,20:14:00,,https://pbs.twimg.com/media/DE4fEDzWAAAyHMM.jpg,,21546,4187
8.863661447344456e+17,2017-07-15 23:25:31+00:00,Twitter for iPhone,This is Roscoe. Another pupper fallen victim to spontaneous tongue ejections. Get the BlepiPen immediate. 12/10 deep breaths Roscoe https://t.co/RGE08MIJox,"https://twitter.com/dog_rates/status/886366144734445568/photo/1,https://twitter.com/dog_rates/status/886366144734445568/photo/1",12.0,10.0,Roscoe,2017-07-15,23:25:31,pupper,https://pbs.twimg.com/media/DE0BTnQUwAApKEH.jpg,french_bulldog,20338,2997
8.862583841518879e+17,2017-07-15 16:17:19+00:00,Twitter for iPhone,This is Waffles. His doggles are pupside down. Unsure how to fix. 13/10 someone assist Waffles https://t.co/xZDA9Qsq1O,https://twitter.com/dog_rates/status/886258384151887873/photo/1,13.0,10.0,Waffles,2017-07-15,16:17:19,,https://pbs.twimg.com/media/DEyfTG4UMAE4aE9.jpg,pug,26886,5932
8.859848000199475e+17,2017-07-14 22:10:11+00:00,Twitter for iPhone,Viewer discretion advised. This is Jimbo. He will rip ur finger right h*ckin off. Other dog clearly an accessory. 12/10 pls pet with caution https://t.co/BuveP0uMF1,https://twitter.com/dog_rates/status/885984800019947520/photo/1,12.0,10.0,Jimbo,2017-07-14,22:10:11,,https://pbs.twimg.com/media/DEumeWWV0AA-Z61.jpg,blenheim_spaniel,31348,6343
8.855289432054702e+17,2017-07-13 15:58:47+00:00,Twitter for iPhone,This is Maisey. She fell asleep mid-excavation. Happens to the best of us. 13/10 would pat noggin approvingly https://t.co/tp1kQ8i9JF,https://twitter.com/dog_rates/status/885528943205470208/photo/1,13.0,10.0,Maisey,2017-07-13,15:58:47,,https://pbs.twimg.com/media/DEoH3yvXgAAzQtS.jpg,pug,34570,6018
8.851676198836388e+17,2017-07-12 16:03:00+00:00,Twitter for iPhone,Here we have a corgi undercover as a malamute. Pawbably doing important investigative work. Zero control over tongue happenings. 13/10 https://t.co/44ItaMubBf,"https://twitter.com/dog_rates/status/885167619883638784/photo/1,https://twitter.com/dog_rates/status/885167619883638784/photo/1,https://twitter.com/dog_rates/status/885167619883638784/photo/1,https://twitter.com/dog_rates/status/885167619883638784/photo/1",13.0,10.0,,2017-07-12,16:03:00,,https://pbs.twimg.com/media/DEi_N9qXYAAgEEw.jpg,malamute,21047,4112
8.849255217417093e+17,2017-07-12 00:01:00+00:00,Twitter for iPhone,"This is Earl. He found a hat. Nervous about what you think of it. 12/10 it's delightful, Earl https://t.co/MYJvdlNRVa",https://twitter.com/dog_rates/status/884925521741709313/photo/1,12.0,10.0,Earl,2017-07-12,00:01:00,,https://pbs.twimg.com/media/DEfjEaNXkAAtPlj.jpg,italian_greyhound,74270,17038
8.848767533904896e+17,2017-07-11 20:47:12+00:00,Twitter for iPhone,This is Lola. It's her first time outside. Must test the earth and taste the atmosphere. 13/10 you're doing great Lola https://t.co/74TKAUsLkO,"https://twitter.com/dog_rates/status/884876753390489601/photo/1,https://twitter.com/dog_rates/status/884876753390489601/photo/1,https://twitter.com/dog_rates/status/884876753390489601/photo/1,https://twitter.com/dog_rates/status/884876753390489601/photo/1",13.0,10.0,Lola,2017-07-11,20:47:12,,https://pbs.twimg.com/media/DEe2tZXXkAAwyX3.jpg,chow,26811,5267
8.845628921456886e+17,2017-07-11 00:00:02+00:00,Twitter for iPhone,This is Kevin. He's just so happy. 13/10 what is your secret Kevin https://t.co/1r4MFCbCX5,https://twitter.com/dog_rates/status/884562892145688576/photo/1,13.0,10.0,Kevin,2017-07-11,00:00:02,,https://pbs.twimg.com/media/DEaZQkfXUAEC7qB.jpg,pug,23355,4430
8.844418053827174e+17,2017-07-10 15:58:53+00:00,Twitter for iPhone,"I present to you, Pup in Hat. Pup in Hat is great for all occasions. Extremely versatile. Compact as h*ck. 14/10 (IG: itselizabethgales) https://t.co/vvBOcC2VdC",https://twitter.com/dog_rates/status/884441805382717440/photo/1,14.0,10.0,,2017-07-10,15:58:53,,https://pbs.twimg.com/media/DEYrIZwWsAA2Wo5.jpg,pembroke,25986,5345
8.841626705843773e+17,2017-07-09 21:29:42+00:00,Twitter for iPhone,Meet Yogi. He doesn't have any important dog meetings today he just enjoys looking his best at all times. 12/10 for dangerously dapper doggo https://t.co/YSI00BzTBZ,https://twitter.com/dog_rates/status/884162670584377345/photo/1,12.0,10.0,Yogi,2017-07-09,21:29:42,doggo,https://pbs.twimg.com/media/DEUtQbzW0AUTv_o.jpg,german_shepherd,19574,2806
8.838381229366313e+17,2017-07-09 00:00:04+00:00,Twitter for iPhone,This is Noah. He can't believe someone made this mess. Got the vacuum out for you though. Offered to help clean pup. 12/10 super good boy https://t.co/V85xujjDDY,https://twitter.com/dog_rates/status/883838122936631299/photo/1,12.0,10.0,Noah,2017-07-09,00:00:04,,https://pbs.twimg.com/media/DEQGFgAXUAAEvfi.jpg,doberman,20998,3250
8.834828469330043e+17,2017-07-08 00:28:19+00:00,Twitter for iPhone,"This is Bella. She hopes her smile made you smile. If not, she is also offering you her favorite monkey. 13.5/10 https://t.co/qjrljjt948","https://twitter.com/dog_rates/status/883482846933004288/photo/1,https://twitter.com/dog_rates/status/883482846933004288/photo/1",13.5,10.0,Bella,2017-07-08,00:28:19,,https://pbs.twimg.com/media/DELC9dZXUAADqUk.jpg,golden_retriever,44119,9307
8.833606908992184e+17,2017-07-07 16:22:55+00:00,Twitter for iPhone,Meet Grizzwald. He may be the floofiest floofer I ever did see. Lost eyes saving a schoolbus from a volcano erpuption. 13/10 heroic as h*ck https://t.co/rf661IFEYP,https://twitter.com/dog_rates/status/883360690899218434/photo/1,13.0,10.0,Grizzwald,2017-07-07,16:22:55,floofer,https://pbs.twimg.com/media/DEJT3FeXoAAtwUy.jpg,chow,21791,3485
8.831178360460861e+17,2017-07-07 00:17:54+00:00,Twitter for iPhone,"Please only send dogs. We don't rate mechanics, no matter how h*ckin good. Thank you... 13/10 would sneak a pat https://t.co/Se5fZ9wp5E","https://twitter.com/dog_rates/status/883117836046086144/photo/1,https://twitter.com/dog_rates/status/883117836046086144/photo/1",13.0,10.0,,2017-07-07,00:17:54,,https://pbs.twimg.com/media/DEF2-_hXoAAs62q.jpg,golden_retriever,35695,6254
8.829920803642204e+17,2017-07-06 15:58:11+00:00,Twitter for iPhone,This is Rusty. He wasn't ready for the first pic. Clearly puppared for the second. 13/10 confirmed great boy https://t.co/tyER0KpdXj,"https://twitter.com/dog_rates/status/882992080364220416/photo/1,https://twitter.com/dog_rates/status/882992080364220416/photo/1",13.0,10.0,Rusty,2017-07-06,15:58:11,,https://pbs.twimg.com/media/DEEEnIqXYAAiJh_.jpg,eskimo_dog,22978,3672
8.827626945117348e+17,2017-07-06 00:46:41+00:00,Twitter for iPhone,This is Gus. He's quite the cheeky pupper. Already perfected the disinterested wink. 12/10 would let steal my girl https://t.co/D43I96SlVu,https://twitter.com/dog_rates/status/882762694511734784/photo/1,12.0,10.0,Gus,2017-07-06,00:46:41,pupper,https://pbs.twimg.com/media/DEAz_HHXsAA-p_z.jpg,labrador_retriever,27171,4604
8.826272703216026e+17,2017-07-05 15:48:34+00:00,Twitter for iPhone,This is Stanley. He has his first swim lesson today. Doggle straps adjusted. Ready to go. 13/10 Phelps is nervous (IG: stanleythe_corgi) https://t.co/Nx52PGwH94,https://twitter.com/dog_rates/status/882627270321602560/photo/1,13.0,10.0,Stanley,2017-07-05,15:48:34,,https://pbs.twimg.com/media/DD-40X3WAAAJPU5.jpg,pembroke,26849,5710
8.822681101993697e+17,2017-07-04 16:01:23+00:00,Twitter for iPhone,This is Alfy. You're witnessing his first watermelon experience. I think it was a success. 13/10 happy 4th Alfy ðŸ‡ºðŸ‡¸ https://t.co/fYP5RlutfA,"https://twitter.com/dog_rates/status/882268110199369728/photo/1,https://twitter.com/dog_rates/status/882268110199369728/photo/1,https://twitter.com/dog_rates/status/882268110199369728/photo/1",13.0,10.0,Alfy,2017-07-04,16:01:23,,https://pbs.twimg.com/media/DD5yKdPW0AArzX8.jpg,golden_retriever,43178,10901
8.820458700359188e+17,2017-07-04 01:18:17+00:00,Twitter for iPhone,"This is Koko. Her owner, inspired by Barney, recently built a cart for her to use during walks if she got tired. 13/10 rest easy Koko https://t.co/zeDpnsKX7w","https://twitter.com/dog_rates/status/882045870035918850/photo/1,https://twitter.com/dog_rates/status/882045870035918850/photo/1,https://twitter.com/dog_rates/status/882045870035918850/photo/1,https://twitter.com/dog_rates/status/882045870035918850/photo/1",13.0,10.0,Koko,2017-07-04,01:18:17,,https://pbs.twimg.com/media/DD2oCl2WAAEI_4a.jpg,golden_retriever,28182,4607
8.81906580714922e+17,2017-07-03 16:04:48+00:00,Twitter for iPhone,This is Rey. He's a Benebop Cumberfloof. 12/10 dangerously pettable https://t.co/503CgWbhxQ,https://twitter.com/dog_rates/status/881906580714921986/photo/1,12.0,10.0,Rey,2017-07-03,16:04:48,,https://pbs.twimg.com/media/DD0pWm9XcAAeSBL.jpg,weimaraner,23369,3200
8.816665953445356e+17,2017-07-03 00:11:11+00:00,Twitter for iPhone,This is Gary. He couldn't miss this puppertunity for a selfie. Flawless focusing skills. 13/10 would boop intensely https://t.co/7CSWCl8I6s,https://twitter.com/dog_rates/status/881666595344535552/photo/1,13.0,10.0,Gary,2017-07-03,00:11:11,,https://pbs.twimg.com/media/DDxPFwbWAAEbVVR.jpg,saluki,48697,10039
8.815360043808727e+17,2017-07-02 15:32:16+00:00,Twitter for iPhone,"Here is a pupper approaching maximum borkdrive. Zooming at never before seen speeds. 14/10 paw-inspiring af 
(IG: puffie_the_chow) https://t.co/ghXBIIeQZF",https://twitter.com/dog_rates/status/881536004380872706/video/1,14.0,10.0,,2017-07-02,15:32:16,pupper,https://pbs.twimg.com/ext_tw_video_thumb/881535971568889856/pu/img/9bawiZ--8FKywTkz.jpg,samoyed,47532,15015
8.812684441964626e+17,2017-07-01 21:49:04+00:00,Twitter for iPhone,Meet Elliot. He's a Canadian Forrest Pup. Unusual number of antlers for a dog. Sneaky tongue slip to celebrate #Canada150. 12/10 would pet https://t.co/cgwJwowTMC,https://twitter.com/dog_rates/status/881268444196462592/photo/1,12.0,10.0,Elliot,2017-07-01,21:49:04,,https://pbs.twimg.com/media/DDrk-f9WAAI-WQv.jpg,,22268,4930
8.809357628999885e+17,2017-06-30 23:47:07+00:00,Twitter for iPhone,This is Louis. He's crossing. It's a big deal. 13/10 h*ckin breathtaking https://t.co/D0wb1GlKAt,https://twitter.com/dog_rates/status/880935762899988482/photo/1,13.0,10.0,Louis,2017-06-30,23:47:07,,https://pbs.twimg.com/media/DDm2Z5aXUAEDS2u.jpg,,16378,2629
8.808724488157716e+17,2017-06-30 19:35:32+00:00,Twitter for iPhone,Ugh not again. We only rate dogs. Please don't send in well-dressed  floppy-tongued street penguins. Dogs only please. Thank you... 12/10 https://t.co/WiAMbTkDPf,https://twitter.com/dog_rates/status/880872448815771648/photo/1,12.0,10.0,,2017-06-30,19:35:32,,https://pbs.twimg.com/media/DDl8zzJW0AAisCJ.jpg,pembroke,20454,3596
8.804658323668132e+17,2017-06-29 16:39:47+00:00,Twitter for iPhone,This is Bella. She had her first beach experience this morning. Complete success. 12/10 would perform a sandy boop https://t.co/4VsFysDmiw,"https://twitter.com/dog_rates/status/880465832366813184/photo/1,https://twitter.com/dog_rates/status/880465832366813184/photo/1,https://twitter.com/dog_rates/status/880465832366813184/photo/1,https://twitter.com/dog_rates/status/880465832366813184/photo/1",12.0,10.0,Bella,2017-06-29,16:39:47,,https://pbs.twimg.com/media/DDgK-J4XUAIEV9W.jpg,golden_retriever,27412,5873
8.80221127280382e+17,2017-06-29 00:27:25+00:00,Twitter for iPhone,Meet Jesse. He's a Fetty Woof. His tongue ejects without warning. A true bleptomaniac. 12/10 would snug well https://t.co/fUod0tVmvK,"https://twitter.com/dog_rates/status/880221127280381952/photo/1,https://twitter.com/dog_rates/status/880221127280381952/photo/1",12.0,10.0,Jesse,2017-06-29,00:27:25,,https://pbs.twimg.com/media/DDcscbXU0AIfDzs.jpg,chihuahua,25963,3962
8.800957828708966e+17,2017-06-28 16:09:20+00:00,Twitter for iPhone,Please don't send in photos without dogs in them. We're not @porch_rates. Insubordinate and churlish. Pretty good porch tho 11/10 https://t.co/HauE8M3Bu4,https://twitter.com/dog_rates/status/880095782870896641/photo/1,11.0,10.0,,2017-06-28,16:09:20,,https://pbs.twimg.com/media/DDa6ckbXgAAM1vV.jpg,miniature_pinscher,26572,4086
8.798624647159276e+17,2017-06-28 00:42:13+00:00,Twitter for iPhone,This is Romeo. He would like to do an entrance. Requesting your immediate assistance. 13/10 https://t.co/Qh5aEkRQm9,"https://twitter.com/dog_rates/status/879862464715927552/photo/1,https://twitter.com/dog_rates/status/879862464715927552/photo/1,https://twitter.com/dog_rates/status/879862464715927552/photo/1",13.0,10.0,Romeo,2017-06-28,00:42:13,,https://pbs.twimg.com/media/DDXmPrbWAAEKMvy.jpg,basset,21494,3289
8.794920405176156e+17,2017-06-27 00:10:17+00:00,Twitter for iPhone,This is Bailey. He thinks you should measure ear length for signs of growth instead. 12/10 https://t.co/IxM9IMKQq8,https://twitter.com/dog_rates/status/879492040517615616/photo/1,12.0,10.0,Bailey,2017-06-27,00:10:17,,https://pbs.twimg.com/media/DDSVWMvXsAEgmMK.jpg,german_short-haired_pointer,22567,2997
8.794158184251843e+17,2017-06-26 19:07:24+00:00,Twitter for iPhone,This is Duddles. He did an attempt. 13/10 someone help him (vid by Georgia Felici) https://t.co/UDT7ZkcTgY,https://twitter.com/dog_rates/status/879415818425184262/video/1,13.0,10.0,Duddles,2017-06-26,19:07:24,,https://pbs.twimg.com/ext_tw_video_thumb/879415784908390401/pu/img/cX7XI1TnUsseGET5.jpg,english_springer,101826,41749
8.793764925678551e+17,2017-06-26 16:31:08+00:00,Twitter for iPhone,This is Jack AKA Stephen Furry. You're not scoring on him. Unless he slips down the slide. 12/10 would happily get blocked by https://t.co/0gOi601EAa,https://twitter.com/dog_rates/status/879376492567855104/photo/1,12.0,10.0,Jack,2017-06-26,16:31:08,,https://pbs.twimg.com/media/DDQsQGFV0AAw6u9.jpg,labrador_retriever,16178,2941
8.790507492626555e+17,2017-06-25 18:56:45+00:00,Twitter for iPhone,This is Steven. He has trouble relating to other dogs. Quite shy. Neck longer than average. Tropical probably. 11/10 would still pet https://t.co/2mJCDEJWdD,https://twitter.com/dog_rates/status/879050749262655488/photo/1,11.0,10.0,Steven,2017-06-25,18:56:45,,https://pbs.twimg.com/media/DDMD_phXoAQ1qf0.jpg,,21680,4410
